{"aggregate_sha256":"d0f8b186210062a86f313611968ade7a8de089e2fb25de99e9c61c235ec9a236","assets":[{"path":"chatgnt/configuration.py","sha256":"1f9a52d1a4369bba828323602867621e7f1beca3bc25f1def8c06750f6ea6c2f"},{"path":"chatgnt/evaluation_protocol.py","sha256":"21f5eae0a6d36a79de38f7848de768b4207aa004d5f15ec7e8d1685339e8bfc4"},{"path":"chatgnt/harness.py","sha256":"b1898c8b7cd718e2614a7f19424f1377fc36eff0805956769de0998dcd7060dd"},{"path":"chatgnt/prompting.py","sha256":"22d03ad9d0e0632c6fc64e5d86eeb1598349160d2b786765166ababf2f5b55a4"},{"path":"config/evaluation-rubric-v1.json","sha256":"710e18fc26e0563594164e1517de0e9c30914b7908e5265d617c1489d705ecbd"},{"path":"config/generation.toml","sha256":"34de881e3eab04b817b6846b8384866363e7cf1096ffdb5dc2ddd12ea5054984"},{"path":"config/inference.toml","sha256":"6f4b10318851a800e44f0ecf448f5f85890fac3eb0d1a9d9bd4899d9d79a4781"},{"path":"config/judge-manifest-v1.json","sha256":"3a6344e1e09509a04101040161d417a3ab2cb1b82ad2da51e81be74b550f2c35"},{"path":"config/model-files.json","sha256":"32fcd98e208644ebd6b2bc5749689203c7637cf625fe7460dd0816ee1767d212"},{"path":"config/model.toml","sha256":"0292c4dad1fec20f663ba69368007d66f05c7adcd6553da414b7a821683810be"},{"path":"config/prompts/five-shot-v3.json","sha256":"cdd68af07f6668c8526c357a7f9df6600d95cbfa03da83bcb5280ee053a89d31"},{"path":"config/prompts/minimal-v1.json","sha256":"f09b7712fb9b36c9fc6fc54b1fc72fbf2d95cc8e5e1d8d570d88a54ccde2d821"},{"path":"config/systems/evaluation-abcd-v1.json","sha256":"1112114f6b7d92556baea225f82907212f1e5c85a351b571387dfb247bb626df"},{"path":"data/evaluation/contamination-calibration-v1.jsonl","sha256":"242d4fae46d975ca31d80c8765e2b9dae9521665c1fc5e9855970e148d1a626b"},{"path":"data/evaluation/judge-calibration-v1.jsonl","sha256":"46ef76c16073998843045ed99221f67a18b6b61b737f939236436f2f393668f9"},{"path":"data/evaluation/response-similarity-calibration-v1.jsonl","sha256":"d156c5fd5a846fc37ccef73a41b805388569d9facbcc76ace181fc3e96631ccf"},{"path":"docs/behavioural-contract.md","sha256":"548baf28c0af7df6820cf85a5e8a23e54bd2a4307fc5410684d5b34f3100389b"},{"path":"docs/blind-pairwise-protocol.md","sha256":"7a7a6e4b958729c738330721c65841b03f28cd79ab0d91dc08352e08fd943877"},{"path":"docs/evaluation-analysis-protocol.md","sha256":"88dcab49fc41f955d37aee278ef4670ac468246fda23f9fa7cae41513599952b"},{"path":"docs/evaluation-metrics.md","sha256":"bbad5aa2a854407767d87586c6307c5e0b6c25d920d19704c33cb46176a41287"},{"path":"docs/evaluation-population.md","sha256":"48437cf94efb9997c82fb5ce36d63a0416431d2ab4d7711f542f07644a227166"},{"path":"docs/experiment-plan.md","sha256":"e80f20bd324c51108bc7c5d654f70f8c8b5ea6ecdf227ca05b9e40f07e21b182"},{"path":"docs/heldout-authoring-protocol.md","sha256":"fa1058fce61742ea7df95ffca03dbff4a65619fba084950825c63487a46b5ba6"},{"path":"docs/qualitative-evaluation-protocol.md","sha256":"1c784abaaceb42becc616ec3a631ed0374797726f7803c70b1e021389606c81a"},{"path":"docs/response-similarity-protocol.md","sha256":"9b95035e2e18ba01a23c1ff8614764eb4dedc1da42352615330638644062d478"},{"path":"docs/similarity-tooling-selection.md","sha256":"1e9953a5b033d29718fffecc41bea32cab8358c6507df4e96901b4e2e4ec9131"},{"path":"docs/stage-3-evaluation-protocol.md","sha256":"20fb06a3ae7bacb180df22727ca8ddc0eac72d53a30be3e571148eea94400865"},{"path":"docs/unseen-contamination-protocol.md","sha256":"9c8815ede59032b2b8dbd413a3e43cb21805c325423df545489e26d1f382dca1"},{"path":"pyproject.toml","sha256":"2cbad966e6ffbc8671704dc4538bb01c85c52bc7d321912ca729dd94de246237"},{"path":"schemas/chatgnt-response-v1.schema.json","sha256":"107f6f93ed77c1a1c057af78e832ab178f817192b90deb8ca333af458591953d"},{"path":"schemas/evaluation-generation-manifest-v1.schema.json","sha256":"de4dace5ada6904f72b7b99fd83a3edfb350d6311fc028f232720d9571ee3652"},{"path":"schemas/evaluation-protocol-manifest-v1.schema.json","sha256":"aa72e00786ac742e470fe4a20b0a77b677b02cc6d82e37a735331473ed3288c8"},{"path":"schemas/evaluation-protocol-v1.schema.json","sha256":"f27ef6c3e4b638580c0770ba22458022b8cac5f603c8442bc20f85e6afd77d81"},{"path":"schemas/heldout-freeze-bundle-v1.schema.json","sha256":"7f8237b81beefa60a56887a2f3aea06febfef8c84169fdb99b01458a1581a680"},{"path":"schemas/heldout-prompt-v1.schema.json","sha256":"e1f80752d4f0f9f8dbe7da100e77f4c7c05afc59f89831f2280436883fc30dbc"},{"path":"schemas/heldout-replacement-v1.schema.json","sha256":"2d5a6bb6aa7e4d4a8b35a1a72ecc9e5b72ba0c52cee9162576991b70fe25b9f6"},{"path":"schemas/pairwise-judgment-v1.schema.json","sha256":"a63779463e114393026ff10971033c9f6d2bd47c2e2803a0f4c94ccc574df7a6"},{"path":"schemas/prompt-overlap-review-v1.schema.json","sha256":"06cd97517c81a788c856ace52b546e0796c6441fcfc922fe41ac1a91de24bb0b"},{"path":"schemas/qualitative-judgment-v1.schema.json","sha256":"3825255798b349eae63fa82d7d1bbb3c5d969dbcc5d8c7cca7a84a5db73f6009"},{"path":"schemas/response-similarity-evidence-v1.schema.json","sha256":"41cb6878a2bc63746dff1e4f66c6e9cf335fe6808ef8f4a7b075212ec2c503d0"},{"path":"schemas/response-similarity-review-v1.schema.json","sha256":"3a481d63611f8a9ef64f9ef87b935699b000a858d10b48ed2afea4eee301dbf9"},{"path":"schemas/source-identity-v1.schema.json","sha256":"fe14f4d2bce3822817e3399a44aae34dde527756bb4a1b5d585d3dc5e61332f1"},{"path":"schemas/stage3-review-artifact-v1.schema.json","sha256":"b80b2b410acd971e4226febc42c341aab7afe1672b864d3dbbff619c9a23c854"},{"path":"schemas/stage3-verification-evidence-v1.schema.json","sha256":"7d1e950ade1b84dbe9ced7f82488103080a7914b73571cfd7c4531bffebc849f"},{"path":"schemas/stage5-semantic-review-v1.schema.json","sha256":"915856ab033c285c4712774f893640e4f6801b237ee4a7d0adac955144e9442f"},{"path":"schemas/withheld-domain-check-v1.schema.json","sha256":"dae73313b84a0a856402b5c1bc4e41c03867d7c287e304821c040574db021490"},{"path":"scripts/capture_stage3_verification.py","sha256":"7dad8326b72a9e7795d5563cb58d72616d4883c4277eeb0c2c2427928f89a28d"},{"path":"scripts/generate_semantic_evidence.py","sha256":"33103427ad36ee5f92d601dbfb6fc2ecee56cdd1993a4b4a949e54e23410dd76"},{"path":"scripts/orchestrate_stage3_review.py","sha256":"526ff36a237b946628727b9092688ea1eb5be78f688aa7f9c9ad8554e864f5b7"},{"path":"scripts/verify_evaluation_protocol.py","sha256":"b9feb48b6375bf5e783a157d3b6ab115a574b065a2d46b925fe3681e8ab1b85f"},{"path":"tests/test_evaluation_protocol.py","sha256":"252d64d4444ecf7d855e9edf45f528c6e61cb23a644f36372691f06465755011"},{"path":"uv.lock","sha256":"31e04ac3b153696e5dee31991f290d42627091acc8cc2a0a2b0b647aada03e0b"}],"manifest_id":"chatgnt-evaluation-manifest-v1","protocol_id":"chatgnt-evaluation-v1","protocol_normative_sha256":"9db43df16c74e2e44c7a244d6777d4363c1de2be2198fdf5d6145748342c45ad","schema_version":1}
